title,sentimen
"Mengintip Doesoen Kakao Banyuwangi, Sentra Produksi Berbagai Varian Cokelat",Netral
"PTPN IV Rugi Rp 100 M gegara Sawit di Simalungun Dicuri, 5 Pelaku Ditangkap",Negatif
PLTS Sei Mangkei Berpotensi Tekan Emisi Karbon 1.300 Ton Per Tahun,Positif
"Produksi BBM Bioetanol Ditargetkan 700 Ribu Ton, Ini Caranya",Netral
"Harga Gula Naik, Plt Mentan Minta Impor Dipercepat",Positif
Pj Bupati Bogor Ingin PKL Segera Dipindah ke Rest Area Gunung Mas Puncak,Negatif
"7 Dapen BUMN Jadi 'Pasien' BPKP, Erick Thohir Kantongi Hasilnya Awal 2024",Positif
Pemandian Ini Sering Dikunjungi Sultan dan Tamu Luar Negeri buat Terapi,Netral
Permintaan Maaf Remaja di Riau yang Caci Maki Jokowi,Negatif
"Harga Gula Melambung, Bulog Ajukan Impor 200.000 Ton",Positif
BUMN Dapat Rp 152 Triliun Buat Pulihkan Ekonomi RI,Netral
Tamu Tasyakuran Pernikahan Kaesang di Solo Akan Diangkut Bus-Andong,Positif
"Sempat Tutup karena Banjir Bandang, Agrowisata Gunung Mas Puncak Buka Lagi",Negatif
"Petani hingga Pebisnis Kopi Kumpul di JIEXPO Kemayoran, Ada Apa Nih?",Positif
Kebun PTPN III Cinta Manis Disegel Buntut Karhutla,Netral
"Seirama Gubernur Jabar, AHY Minta Setop Pembangunan Tak Sesuai Tata Ruang",Positif
"Ke Kantor Mahfud, Tim Rizieq Minta Lahan Markaz Syariah Tak Diambil",Negatif
"Banjir Bandang Terjang Bondowoso, Puluhan Kandang Ternak Warga Tersapu Habis",Negatif
"Nggak Cuma Gaji, Holding BUMN Perkebunan Tebar Bonus Ini buat Petani",Negatif
Antisipasi Depresiasi Rupiah Bagi Ketahanan Finansial BUMN,Netral
"Miniatur Ka'bah di Masjid Dirobohkan Perusahaan, MUI Langkat Mediasi",Netral
Transformasi BUMN Menjadi Lokomotif Ekonomi Nasional,Netral
"1 Pelajar di Serdang Begadai Tewas Ditembak, Begini Kejadiannya",Negatif
"Erick Thohir Lepas Ekspor Kopi ke Mesir, Targetnya 3.000 Ton",Negatif
"Erick Thohir Rekrut 'Anak Muda' Jadi Pejabat BUMN, Siapa Saja?",Negatif
Jaksa Agung: Habisi Mafia Tanah!,Negatif
Hidupkan Kejayaan Surabaya dari Keberhasilan Pembangunan Kota,Positif
Eks Bupati Inhu dan Surya Darmadi Tersangka Korupsi Lahan Duta Palma,Negatif
Holding BUMN Pangan Fokus Geber Produksi Gula Tahun Depan,Netral
"3 BUMN Buka Lowongan Kerja untuk Lulusan S1-S2, Begini Syaratnya",Positif
Kejari Banyuwangi Pasang Delapan Plang di Tanah Perkebunan PTPN XII,Negatif
"9 Tempat Angker di Sukabumi, Jembatan Kuning-Pabrik Peninggalan Belanda",Negatif
Andre Gerindra Dukung Langkah Erick Thohir Restrukturisasi PTPN,Positif
"Migor Murah Tak Perlu DMO-DPO, Pengusaha: Kasih Tanggung Jawab ke BUMN",Negatif
"Pensiunan BUMN di Pekanbaru Tewas dalam Rumah, Mobil-Barang Berharga Raib",Netral
Markaz Syariah FPI Minta Bantuan Mahfud MD soal Sengketa Lahan Puncak,Negatif
"Operasi Pasar Puasa-Lebaran Digelar, Segini Harga Bahan Pangan yang Dijual",Positif
Zulhas Pimpin Penyegelan 4 Perusahaan yang Diduga Rusak Lingkungan di Bogor,Netral
"Duduk Bareng Pemerintah, Petani Masih Tolak Draft Perpres Swasembada Gula",Negatif
"UMKM Binaan BUMN Raih Penjualan Rp 5,7 Miliar di INACRAFT 2025",Positif
Indonesia Butuh 10 Pabrik Bioetanol untuk Hasilkan 7 Juta BBM Etanol,Positif
"5 Pekerja Pabrik Bioetanol Mojokerto Dilarikan ke Rumkit, 3 Tewas 2 Selamat",Positif
Jurus BUMN Bantu Petani Kopi Lebih Moncer,Netral
"Tekan Harga, Holding BUMN Guyur 2,75 Juta Liter Minyak Goreng ke Pasar",Positif
Andre Rosiade Bentengi Erick Thohir dari Kritik Adian Napitupulu,Netral
DPR Restui PMN BUMN Rp 23 T dan Pencairan Utang Pemerintah Rp 115 T,Negatif
"Penuhi Pasokan Gula, Pabrik Milik BUMN Siap Genjot Produksi",Positif
Samsul Tarigan yang Didakwa Rp 41 M gegara 'Sulap' Lahan PTPN Jadi Diskotek,Netral
"Pabrik Migor Anak Usaha BUMN Mau IPO, Begini Rencananya",Negatif
10 Rekomendasi Tempat Wisata Keluarga di Siantar-Simalungun,Netral
Ada Biyong di Antara PTPN VS Markaz Syariah FPI,Netral
Melihat Lagi Isi Somasi PTPN soal Markaz Syariah Habib Rizieq,Positif
"Tak Hanya Cari Cuan, Holding BUMN Perkebunan Juga Fokus Hal Ini",Negatif
Polda Jabar Segera Panggil Sejumlah Pihak yang Dilaporkan PTPN VIII,Positif
Cara BUMN Tangkal Krisis Pangan yang Kian Dekat,Negatif
RI Gandeng Jepang Sulap Limbah Jadi EBT,Netral
Bareskrim Mulai Proses Laporan PTPN VIII Terkait Lahan Markaz Syariah,Positif
20 Juni Lapangan Merdeka Medan Dikosongkan,Netral
"Kunjungi Warga Onggoboyo, Mas Dhito Dicurhati soal Akses Air Bersih",Netral
"Pakar UI: Memang Sudah Saatnya Puncak Direstorasi, Konsep Pariwisata Diubah",Negatif
Juragan Teh RE Kerkhoven: Manis Kelola Bisnis dan Cinta yang Tragis,Positif
Kereta Cepat dan Masa Depan Transpotasi di Indonesia,Negatif
Wagub Emil Beber Update Pembangunan Tol Probowangi: Terus On Progress,Netral
"Pabrik Gula RI Banyak yang Sudah 'Bangkot', Usianya 2 Abad Lebih",Negatif
Ini Dia Sumber Susu buat Program Makan Bergizi Gratis Prabowo,Netral
Kereta Api dan Jejak Penjajahan Belanda di Priangan,Negatif
Samsul Tarigan Dituntut Penjara 2 Tahun karena Kuasai Lahan PTPN di Binjai,Negatif
Harga TBS Sawit di Riau Turun Jadi Rp 2.702 per Kg,Positif
"Biar Enggak KO Diterjang Corona, BUMN Dapat Dana Talangan",Netral
"Kejar Target, Pertamina Kebut Proyek Energi Baru Terbarukan",Netral
BKKBN Dukung PTPN V Atasi Stunting di Riau,Positif
"Lewat Rumah BUMN, UMKM Bisa Unjuk Gigi di Ajang Dunia",Negatif
PTPN VIII Tegaskan Lagi Markaz Syariah Milik HRS Ada di Areal Mereka,Positif
97 Kopi Made in Garut hingga Toraja Mejeng di Pameran Eropa,Negatif
"Ketuk Swasta soal Minyak Goreng, Erick Thohir: Jangan Jadi Orang Asing!",Netral
Erick Thohir Kerahkan BUMN Geber Hilirisasi,Positif
Pertamina Siapkan Investasi US$ 18 Miliar untuk Energi Baru Terbarukan,Positif
Sipir Rutan Pekanbaru Tabrak Polisi gegara Takut Ditangkap Bawa Sabu,Negatif
10 Fakta Terkini Aksi Show of Force Mayor Dedi di Polrestabes Medan,Positif
Proyek Tol Serang-Panimbang Seksi III Terancam Molor,Negatif
"Niat Awal Ziarah, Malah Mabuk & Berujung Petaka Karena Ngonten di Atas Sutet",Negatif
Snapshots: Penampakan Pipa-Jam Mencurigakan di Dekat Denpom Solo,Positif
DLH Bandung Ungkap Sejumlah Penyebab Meluapnya Sungai Ciwidey,Negatif
"Program 3 Juta Rumah Diusulkan Jadi PSN, Ternyata Ini Alasannya",Positif
"Curi Sawit PTPN IV hingga 3 Ton Sehari, 7 Warga di Langkat Ditangkap",Negatif
KPK Periksa 3 Saksi Kasus Dugaan Korupsi Pengadaan Six Roll Mill di PTPN XI,Negatif
"Ada PalmCo, Petani Sawit Pesan Begini",Netral
"Petani Vs Korporasi soal Tanah, Menaker Janji Teruskan ke ATR/BPN",Netral
Holding BUMN Perkebunan Dapat Pengakuan Internasional Gegara Ini,Negatif
Erick Thohir Minta BUMN Gandeng Swasta-Petani: Jangan Semua Diambil!,Negatif
Brantas Abipraya Bagikan 2.500 Paket Sembako ke Warga Jember,Positif
Mengenal Pura Penataran Dharmaraksaka dan Asal-usul Kampung Bali di Sergai,Netral
Seru Juga Naik Jip Menyusuri Perkebunan Teh Lereng Gunung Slamet,Positif
Daftar Utang PTPN Grup yang Bakal Dapat Keringanan dari Kreditur,Negatif
BUMN Diminta Lakukan Langkah Antisipasi Dampak Perang Iran Vs Israel,Negatif
BUMD DKI Akan Bangun Pabrik Minyak Goreng di Cilegon,Netral
Polisi Dalami Puluhan LP yang Dilaporkan PTPN VIII soal Lahan Megamendung,Positif
"PTPN III Masih Lanjut Penyelesaian Sengketa Lahan di Pematang Siantar, Begini Jurusnya",Negatif
"Muncul Lagi Selebaran di Klaten, Ada yang Singgung Eks Mensos Juliari",Negatif
Andre Gerindra: Pemerintah Perlu Stimulus BUMN,Netral
PTPN VIII: Markaz Syariah Berada di Lahan Milik Kami,Positif
KPK Periksa 6 Saksi Dugaan Korupsi Pengadaan Lahan PTPN XI,Negatif
Terkuak! Ini Alasan 7 BUMN Dibubarkan,Netral
"Holding BUMN Perkebunan Lahirkan 'Anak', Ada yang IPO Tahun Depan",Negatif
Tragis Deni Gosong Tersengat Listrik Saat Panjat Sutet Demi Konten,Netral
"November 2023, PalmCo Bakal Mejeng di Pasar Modal",Netral
Moeldoko Temui Perwakilan Petani di Medan yang Pernah Jalan Kaki ke Istana,Positif
Relokasi Korban Banjir Bandang-Longsor Lebak Terkendala Lahan,Negatif
"DPR Setuju Garuda dan Krakatau Steel Dapat Dana Talangan Rp 11,5 T",Positif
"2 Direktur Ditusuk di Proyek Perumnas dan PTPN II, Pembangunan Lanjut?",Netral
"Dorong Pemerataan Ekonomi, Holding BUMN Kebun Tanam Sawit di Enrekang",Netral
Giliran Komisaris 13 Perusahaan PTPN Dirombak Erick Thohir,Negatif
"Dukung Target 61.000 Ton Gula, Bupati Banyuwangi Ingin Petani Diberdayakan",Positif
