title,sentimen
"Mahfud Temukan Mafia Tanah Lahan PTPN II yang Rugikan Negara Rp 1,7 T",Negatif
5 Rekomendasi Wisata Dataran Tinggi di Probolinggo,Positif
Resmi! Holding PTPN Merger 13 Perusahaan Jadi PalmCo dan SupportingCo,Positif
"Viral Kebun Jagung Dibabat Anak BUMN Perkebunan, Warga Pasrah dan Menangis",Negatif
"100 Hari Prabowo-Gibran, BUMN Fokus Kolaborasi Kejar Swasembada Pangan",Negatif
3 Pria Kepergok Curi Pipa Besi PTPN 4 di Simalungun,Negatif
Kala Habib Rizieq Analogikan Sambutan ke Artis dengan Kasusnya,Positif
Babat Pohon Berujung Empat Petani Garut Diproses Hukum,Negatif
Pemprov Sulsel Gandeng PTPN Ciptakan Lapangan Kerja Program Budi Daya Pisang,Positif
"Nimo Highland, Wisata Baru Ala Santorini di Pangalengan",Netral
Pabrik Pengolahan Karet PTPN XII di Jember Terbakar,Netral
PTPN Buka Suara Usai KPK Tetapkan 3 Tersangka Korupsi Pembelian Lahan,Negatif
Sudah Tahu Siapa yang Bikin Harga Gula Mahal?,Positif
Akhirnya Harimau yang Resahkan Warga Aceh Timur Berhasil Masuk Perangkap,Negatif
"FPI Dilarang, BPN: 'Penyelamatan' Lahan PTPN Bisa Lebih Cepat",Netral
"Bikin Baper, Intip Momen Romantis Bobby Nasution di Ultah Kahiyang",Positif
APD 3 Pekerja Pabrik Bioetanol Mojokerto yang Tewas Ditemukan di Kolam Pengendapan,Positif
"Erick Thohir hingga Bahlil ke Kantor Airlangga, Bahas Apa?",Positif
"Tim ITS Raih Juara 1 Kapal Robot, Kalahkan MIT & Lima Kali di Posisi Pertama",Negatif
"KPK Lelang Barang Koruptor Jelang Hakordia, Ada Mercy-Fortuner Murah",Positif
"Ngeri! Nekat Ngonten Panjat SUTET Saat Mabuk, Pria Garut Gosong Kesetrum",Negatif
Erick Thohir Buka-bukaan Pangkas Direksi PTPN Sempat Bikin Ribut,Negatif
Gubernur Riau Puji Program Peremajaan Sawit Rakyat PTPN V,Netral
"7 Pusat Oleh-oleh Banyuwangi Ini Wajib Dikunjungi, di Mana Saja?",Netral
Rakerwil AMSI Bangkitkan Pertumbuhan Ekonomi Digital Jawa Timur,Netral
Dirut PTPN III Bongkar Cikal Bakal Transformasi Holding Perkebunan Negara,Negatif
Dirut PTPN XI Surabaya Sempat Diperiksa KPK Saat Penggeledahan,Negatif
"Banyuwangi Rekonstruksi 36 Jembatan di 2023, Pengerjaannya Padat Karya",Positif
Slurpp! Istimewanya Kopi Ijen dengan Cita Rasa Kacang dan Cokelat,Netral
Heboh Warga Temukan Mayat Kakek Tergeletak di Kebun Sawit Sergai,Netral
"Temui Pj Bupati Bogor, Bey Machmudin Bahas Penataan Kawasan Puncak",Positif
Jokowi Resmikan Pabrik Minyak Makan Merah Pertama di Deli Serdang,Positif
"Erick-Ara Kumpulkan Pengembang, Bahas Tanah buat Bangun Rumah",Positif
"Kemendag Tak Bisa Sendirian Kendalikan Minyak Goreng, Perlu Libatkan BUMN?",Netral
Bupati Mojokerto Dukung Revitalisasi Industri Gula Nasional,Positif
"Jelang Idul Adha, Satgas Pangan Awasi Importasi Gula di Tanjung Priok",Positif
"Soal Petani Milenial, RK: Dinas Belum Imbangi Kecepatan Pemikiran Saya",Netral
KPK Geledah Kantor PTPN XI Surabaya Terkait Lahan di Pasuruan-Situbondo,Netral
Bos PTPN Wanti-wanti Stok Gula Menipis Bikin Harga Terkerek,Positif
"Jual Gula 1 Kiloan, PTPN Jamin Tak 'Sikat' Jatah Swasta",Netral
"TNI Resmikan Program Pipanisasi di Sukabumi, 600 Hektare Sawah Terairi",Netral
Sensasi Naik Jip Menyusuri Indahnya Perkebunan Teh Lereng Gunung Slamet Brebes,Netral
"Mengenal Minyak Makan Merah yang 'Diendorse' Jokowi, Produk Koperasi & PTPN",Positif
"Kabar Baik, Harga Sawit di Riau Nyaris Tembus Rp 3.000/Kg",Positif
Mayat Pria di Bandung Barat Dilaporkan Hilang Sejak Malam Tahun Baru,Negatif
Bulog Dicoret dari Daftar Penerima Dana Talangan,Positif
"Amfiteater Osing, Sarana Atraksi Baru di Perkebunan Coklat Glenmore",Negatif
"Korban Banjir Bandang Kalibaru Banyuwangi Demo, Minta Relokasi Dipercepat",Negatif
Heboh Pembangunan Lokasi Hiburan 'Rusak' Kebun Teh Puncak,Negatif
Kejari Binjai Buka Suara Usai Tuntutan Samsul Tarigan Tak Kunjung Tuntas,Negatif
Polisi Temukan Unsur Pidana Soal Ledakan Pabrik Bioetanol di Mojokerto,Netral
KLHK Segel Lahan Terbakar di Perkebunan Tebu PTPN VII Cinta Manis,Negatif
Ponpes Habib Rizieq Disomasi untuk Serahkan Lahan di Megamendung,Netral
"Kasus Mafia Tanah di PTPN II Deli Serdang, Mahfud Md: Sponsornya Pebisnis",Positif
Kades Buka Suara Usai Dipolisikan Nasabah Koperasi Kasus Penggelapan Uang,Netral
Heboh Sewa Helikopter Wagub Jabar hingga Polemik Petani Milenial,Positif
10 Destinasi Wisata Gadis Kretek,Netral
Holding BUMN Perkebunan Buka Suara soal Mantan Pejabat Jadi Tersangka KPK,Negatif
Akhirnya Korban Banjir Kalibaru Banyuwangi Bisa Tempati Hunian Tetap,Negatif
10 Pembobol Gudang Kopi Milik PTPN Kalisat Bondowoso Dibekuk,Netral
Andre Rosiade Dukung Erick Thohir Bongkar Kasus Dapen BUMN,Netral
Asa Tim Advokasi Markaz Syariah ke Kantor Mahfud Demi Minta Perlindungan,Netral
Tampang Pria Penikam Kakek Pedagang Sayur hingga Tewas di Labuhanbatu,Positif
"Kinerja Moncer, 4 Anak Usaha PTPN III Siap Melebur ke Palm Co",Negatif
"Belajar dari Markaz Syariah vs PTPN, Yuk Pahami Aturan Tanah Terlantar",Positif
Direktur Operasional Cerita Kuota Bansos Corona PT Pertani Dipotong Kemensos,Negatif
Keren! Aliran Air Terjun Bondowoso Ini Bak Ditelan Bumi,Negatif
KPK Duga Ada Deal Uang Saat Proses Jual Beli Lahan Tebu PTPN XI,Positif
Ini Tips Mengembangkan Karier di Tengah Gempuran AI ala Alumnus Unair,Positif
Puluhan Ternak Warga Bondowoso Hilang Tersapu Banjir Bandang Ijen,Negatif
"Holding PTPN III Terjun ke Bisnis Ritel, Jual Minyak Goreng hingga Kopi",Positif
DPR Panggil Dirut Krakatau Steel hingga PTPN Bahas Dana Talangan,Positif
Fakta-fakta Terbaru Sengketa Lahan PTPN VIII dengan Markaz Syariah FPI,Netral
"Jurus ID FOOD Kejar Swasembada Pangan, Tanam 692 Ha Lahan dengan Padi-Sawit",Negatif
Kementerian Buka Suara soal BUMN Lelang Gula di Atas HET,Netral
Penjelasan Habib Rizieq Terkait Kasus Tanah Ponpes Markaz Syariah,Positif
"12 Wisata Malang yang Murah untuk Keluarga, Ada Pantai hingga Kebun Teh",Netral
Pembangunan Bianglala di Kebun Teh Puncak Dihentikan Sementara,Negatif
"PLTBg Sei Mangkei Sudah Hasilkan 6,9 Juta kWh Listrik hingga Saat Ini",Positif
Polri Dukung Langkah Percepatan Swasembada Pangan,Positif
Ternyata Begini Kondisi Rest Area Gunung Mas Tempat Rekolasi PKL Puncak,Negatif
"Diduga Picu Banjir, 4 Tempat Wisata di Puncak Bogor Disegel!",Negatif
"Bayi Baru Lahir Dibuang dalam Plastik di Deli Serdang, Polisi Buru Ortu",Negatif
DPRD Banyuwangi Keluarkan Rekomendasi Atasi Banjir,Netral
Danantara dan Persimpangan Transformasi BUMN,Negatif
Akhir Pelarian Penusuk 2 Direktur Perusahaan BUMN di Sumut,Negatif
"Bangganya Buruh Pabrik di Riau, Putrinya Jadi Paskibraka di Istana Merdeka",Positif
"Sebelum Lebaran, Bangunan Hibisc Puncak Harus Sudah Selesai Dibongkar",Negatif
Tangisan Gubernur Dedi Melihat Carut Marut Puncak Bogor,Negatif
"DPR Soroti Harga Gula Naik Jelang Ramadhan, Ini Sarannya",Positif
"PTPN Salurkan 5,5 Ton Sembako ke Korban Banjir Bandang Luwu",Negatif
900 Jiwa Terdampak Banjir Bandang di Gunung Mas Puncak Bogor,Negatif
"Cuan! Holding BUMN Perkebunan Kantongi Laba Bersih Rp 6,02 T",Positif
Dana Pensiun BUMN Sakit-sakitan Bikin Erick Thohir Lapor Kejaksaan,Positif
bankjatim Siap Beri Kredit ke Petani Tebu Binaan SGN,Netral
Jabar Hari Ini: Herry Dituntut Hukuman Mati-Pembunuh Remaja Geng Motor Ditangkap,Negatif
Ribuan Warga Sekitar Perkebunan di Jember Jalani Vaksinasi,Negatif
"Biaya Bengkak! Malaysia Batalkan Proyek Kereta Cepat, Jokowi Malah Lanjut Pakai APBN",Negatif
Erick Thohir dan Sri Mulyani Mau Bentuk 6 Holding BUMN Tambahan,Positif
Pemprov Jambi Buka Layanan Mudik Gratis 2025 Gandeng BUMN,Netral
Jurus PTPN Pastikan Pembentukan Tiga Subholding BUMN Perkebunan Bisa Mulus,Netral
Baliho Erick Thohir Mejeng Dekat Penjara Soekarno di Bandung,Negatif
"Diperiksa 4 Jam, Dahlan Iskan Sebut Akan Ada Tersangka Baru Kasus PTPN VI",Negatif
"Menengok RS Lavalette, Rumah Sakit Legendaris di Malang yang Sarat Sejarah",Negatif
10 Korban Ledakan Pabrik Bioetanol Mojokerto Dievakuasi ke Rumah Sakit,Negatif
"Tipu Warga Miliaran Rupiah, Pasutri di Simalungun Ditangkap",Negatif
"Nah Lho! Erick Thohir Sebut Sering Terjadi Korupsi di BUMN, Kok Bisa?",Negatif
Kemnaker Harap PTPN III-FSPBUN Bisa Jalin Hubungan Industri Harmonis,Netral
Sejarah 'Kota Mati Karawang' yang Jadi Saksi Bisu Ambruknya Orde Baru,Netral
Festival Kopi Nusantara di Bondowoso Cari Barista Terbaik di Indonesia,Negatif
"Bocor Rancangan Perpres Swasembada Gula Bikin Petani Resah, Apa Isinya?",Negatif
"Sengketa Lahan di Sumut Berlarut-larut, Jokowi Turun Tangan",Positif
Ada 77.295 Kasus Kecelakaan Kerja di 2019,Netral
Kisah Noni Belanda Mandi di Balik Penemuan Benda Purbakala Klaten,Positif
"Edarkan Narkoba ke Rekan Kerja, Satpam PTPN III Diciduk Polisi",Positif
"Lawan PTPN VIII di Kasus Lahan, Markaz Syariah FPI Minta Bantuan Mahfud",Netral
Kok Proyek Kereta Cepat Jakarta-Bandung Boleh Pake APBN? Ini Alasannya,Negatif
Ini Daftar Eks Direktur PTPN XI hingga Pejabat Pasuruan yang Diperiksa KPK,Negatif
Camping Embun Sangat Membantu Warga Perkebunan Banyuwangi Urus Adminduk,Negatif
Hasil Rapat DPR dan Erick Thohir soal Pembayaran Utang hingga PMN,Netral
"Komplotan Spesialis Bobol Brankas di Jateng Dibekuk, 5 Buron",Netral
"Pelindo I Mau Naikkan Volume Bongkar Muat, Ini Jurusnya",Negatif
KPK Geledah Kantor PTPN XI Surabaya,Negatif
Pedagang Puncak Ngeluh Tak Punya Rumah Usai Lapak Dibongkar: Tidur di Terpal,Negatif
"3 Bulan Tak Digaji, Petani Sawit di Riau Curhat ke KSP soal Pengurus Kebun",Negatif
"Konflik Lahan PTPN di Megamendung Tuntas Setelah 25 Tahun, Ini Kuncinya",Positif
Begini Jurus Pengusaha Lokal Biar Terus Berkembang,Positif
Terkuak Sumber Susu Pendukung Program Makan Gratis Prabowo,Positif
"PTPN VIII Juga Laporkan Pastor Gabriele ke Bareskrim, Kenapa?",Positif
22 Rumah di Puncak Bogor Rusak Diterjang Angin Kencang,Negatif
Anak Usaha Bakal Bikin Lahan Jumbo BUMN Perkebunan Jadi Lebih Cuan,Negatif
"RI Masih Impor, Begini Cara BUMN Genjot Swasembada Gula",Netral
Polisi Periksa 15 Saksi soal Pelajar Tewas Ditembak OTK di Sergai,Negatif
DPR Panggil Bos PTPN Bahas 'Penggabungan' 35 Pabrik Gula,Netral
Polri Usut Dugaan Korupsi Proyek Pabrik Gula Assembagoes PTPN XI,Negatif
Mau Kerja di BUMN? Ini Tips dan Triknya,Positif
Mengintip Kontribusi BUMN: Jaga Penerimaan Negara hingga Serap Pekerja,Positif
Polisi Soal Pelajar Tewas Ditembak OTK di Sergai: Diduga Hendak Tawuran,Negatif
"Garang saat Maki Jokowi, Remaja di Riau Minta Maaf Setelah Ditangkap",Negatif
"13 Lembu Milik Warga Asahan Mati, Diduga Diracun",Negatif
Markaz Syariah Pakai Aturan Ini Jelaskan Beli Tanah HGU PTPN dari Petani,Netral
Erick Thohir Buka Rahasia Krakatau Steel Untung Rp 1 T,Netral
"39 Pejabat Kemenkeu Rangkap Jabatan Jadi Komisaris, Ini Daftarnya",Negatif
"Erick Thohir Tutup 74 Anak-Cucu BUMN, Paling Banyak di Pertamina-PTPN",Negatif
"Sssst... Ada Industri Sawit Mau Melantai di Bursa, Kepoin Prospeknya",Positif
Kondisi Terkini Deni yang Tersengat Listrik Saat Bikin Konten di Sutet,Netral
Bupati Bandung Harap Soljer Fair Tekan Angka Pengangguran & Bantu UMKM,Negatif
Tim Hukum HRS Mau Dialog Bareng PTPN soal Polemik Markaz Syariah,Netral
Jurus Holding BUMN Perkebunan Geber Kinerja buat Dongkrak Ekonomi RI,Netral
Cerita Lemparan Janur Kiai Mas Jadi Tempat Berdirinya PG Prajekan Bondowoso,Netral
"Habib Rizieq Singgung Lahan PTPN Telantar, BPN: Kedua Pihak Harus Buktikan",Negatif
Ini Daftar 35 Toko di Medan Agen Minyak Goreng Curah Rakyat,Negatif
"Lahan Markaz Syariah Diminta PTPN, FPI Pegangan Putusan MA Tahun 1958",Negatif
Intip Proses Pucuk Daun Menjadi Minuman dengan Wisata Kebun Teh,Netral
OJK Dorong Perbankan Tingkatkan Permodalan untuk Petani Sawit,Netral
"Amran Gandeng Erick Thohir, Kejar Swasembada Pangan dalam 4 Tahun",Negatif
"Disomasi PTPN, Markaz Syariah Dijaga Ketat",Negatif
Gubernur Khofifah Bantu Warga Terdampak Banjir Kalibaru Banyuwangi,Negatif
"Luhut Pimpin Komite Kereta Cepat Jakarta-Bandung, Begini Deretan Tugasnya",Negatif
"Erick Thohir Lanjutkan 'Bongkar Pasang' BUMN, Ini Bocorannya",Negatif
"Perusahaan Sawit PalmCo Mau IPO, Targetkan Raup Dana hingga Rp 10 T",Positif
"BUMN Genjot Budidaya Kopi Agar Bisa Diekspor, Ini Caranya",Netral
"Rencana Besar Erick Thohir Gabungkan Bulog, RNI, dan PTPN",Negatif
Andre Rosiade Minta PTPN Dukung Pemerintahan Prabowo Capai Swasembada Pangan,Positif
Babak Baru Polemik Lahan Markaz Syariah Saat HRS Dipolisikan,Netral
Pria Garut Tewas di Kebun Karet dengan Luka Gorok,Negatif
Ini Daftar BUMN yang Diusulkan Dapat PMN hingga Dana Talangan,Positif
Erick Thohir Buka-bukaan 70% Dana Pensiun BUMN Sakit!,Negatif
"6 Sekolah Pariwisata Rekomendasi Kemenparekraf, buat yang Suka Traveling Nih!",Positif
"Petani Dapat Penjaminan Kredit dari BUMN, Ini Manfaatnya",Netral
Penganiaya Pengelola Parkir di Medan Pernah Dihukum karena Kampanyekan Prabowo,Positif
8 Polisi Rekayasa 'Ganja Tak Bertuan' Berbuntut Ancaman Pemecatan,Negatif
"Curi 3 Tandan Sawit, Ibu di Rohul Riau Dilaporkan ke Polisi",Netral
"Importir Serap Gula Lokal Rp 11.200/Kg dari Petani, Begini Datanya",Negatif
"IRT Tipu Warga Modus Masuk TNI/Polri Jadi Tersangka Lagi, Kerugian Rp 3,3 Miliar",Negatif
"Erick Thohir Mau Bikin Klaster Pangan, Ekonom: Di Atas Kertas Bagus",Netral
14 Tempat Wisata Malang yang Seru dan Cocok untuk Keluarga,Negatif
"Bertemu Menteri ATR, Gubsu Edy Jamin Masalah Tanah di Sumut Segera Tuntas",Positif
Polisi Sebut Tewasnya 3 Pekerja Pabrik Bioetanol Mojokerto Kecelakaan Kerja,Positif
Jurus BUMN Cegah Pegawai Terlibat Narkoba,Positif
"Terputus Total Lebih 20 Jam, Akses ke Ijen Bondowoso Kini Terbuka Kembali",Positif
3 Perintah Erick Thohir untuk Holding PTPN III Biar Nggak Kolaps,Negatif
"PLN Mau Sulap Pembangkit Batu Bara Jadi Pakai Sampah, Bisa Ya?",Netral
Tiga Pekerja Pabrik Bioetanol Mojokerto Diduga Tewas Keracunan Gas,Netral
Melihat Klaim Habib Rizieq soal HGU di Lahan PTPN,Positif
"Umbul Brintik Klaten, Dikunjungi Sultan hingga Tamu Luar Negeri untuk Terapi",Netral
"Bentuk PalmCo, Holding Perkebunan Kejar Produksi Minyak Goreng 1,8 Juta Ton",Netral
Kemendag Wajibkan BUMN Lelang Gula di Bawah HET,Negatif
Road to Gothia Cup 2025: Daftar 20 Tim di Grand Finale,Negatif
"Banjir Bandang Terjang Gunung Mas Bogor, 1.800 Orang Terdampak",Negatif
"Pemkab Bogor Bakal Tertibkan Vila Ilegal di Puncak, Terancam Bisa Ditutup",Negatif
Erick Thohir Pastikan Copot Dirjen Daglu dari Komisaris PTPN III!,Netral
"PTPN Mau Serap Tebu Petani, Siap Beli Rp 11.500/Kg",Netral
"Menko Zulhas Kebut Produksi Gula di Sumut, Targetkan Naik 100% Tahun 2027",Netral
Remaja Diduga Curi Sawit Tewas Usai Dipukuli Sekuriti PTPN III di Labusel,Negatif
"Sapi Dimangsa jadi Umpan, Harimau di Aceh Timur Masuk Perangkap",Negatif
"Unhas Uji Bergerak Darat Pesawat Montir Tamatan SD, Bisa Melesat 240 Km/Jam",Netral
Yuk Melihat Cara Membuat Cokelat di Doesoen Kakao Banyuwangi,Positif
"Babak Baru Markaz Syariah FPI vs PTPN VIII, Begini 3 Faktanya",Negatif
Jabar Hari Ini: Kota Mati Tommy Soeharto-Sosok Tuyul Terkuak,Negatif
Puluhan Jabatan Direktur di PTPN Dihapus,Negatif
"Dikukuhkan Jadi Guru Besar USU, Muryanto Amin Bicara Transformasi Parpol",Positif
Makin Panjang Perseteruan Gubsu Edy Vs Walkot Bobby,Negatif
"Alih Fungsi Lahan di Puncak Disorot Gubernur Jabar, PT Jaswita Angkat Bicara",Positif
Kepala BP2MI Buka Opsi Moratorium Kirim Pekerja ke Malaysia,Positif
"Usai Bunuh Mahasiswa Unej, Pelaku Nikah-Kabur ke Bali Hingga Tertangkap",Negatif
"Erick Ingatkan Bersih-bersih Dapen BUMN Bukan soal Penjarakan Oknum, tapi...",Negatif
"Festival Cokelat Glenmore, Angkat Potensi Cokelat Terbaik Dunia di Banyuwangi",Positif
Pupuk Indonesia Ajak UMKM Perluas Pasar Lewat PaDi UMKM Expo 2023,Positif
Terungkap! Penyebab Jokowi Marah soal Lahan untuk Investor,Negatif
Bangga! RI Punya Juara Kedua World Cup Tasters Championship 2023,Positif
Daftar 6 BUMN yang Punya Utang Menggunung,Negatif
Erick Thohir Lapor ke Jokowi 79 Proyek Strategis Garapan BUMN Beres,Positif
"Wisata Kota Tua Surabaya Mulai Direvitalisasi, Kawasan Eropa Dipercantik",Negatif
"PTPN Group di 2021-2024 Raih Laba Rp 14,9 T",Positif
"Jalan Penghubung Tapsel-Madina Putus, Mobil Tak Bisa Lewat",Positif
"Kelompok Tani di Rohul Dapat Kucuran Rp 1,3 M Untuk Pulihkan Ekonomi",Netral
Rencana Besar Erick Thohir 'Gabungkan' BUMN Pangan dan Perkebunan,Negatif
Ngonten di Tower Sutet Ala Deni yang Berujung Petaka,Negatif
Warga Demo Tolak Lahan Sawit di Enrekang gegara Dianggap Rugikan Petani,Negatif
"Tingkatkan Produktivitas, PTPN VIII dan Serikat Pekerja Buat Kesepakatan",Positif
Menimbang Waktu yang Tepat Bagi Pabrik Migor BUMN Melantai di Bursa,Netral
PTPN III Minta Rp 4 T Buat Peremajaan Sawit hingga Perbaiki Jalan,Negatif
2 Direktur Anak Perusahaan BUMN di Sumut Diduga Ditusuk Orang Tak Dikenal,Negatif
"Barata Tambah Daftar BUMN yang Punya Utang Segunung, Tembus Rp 3,47 T",Netral
Bocoran Terbaru soal Jumlah BUMN Mau Dipangkas Jadi 30,Negatif
Program-Capaian Bahtiar Baharuddin 8 Bulan Jabat Pj Gubernur Sulsel,Negatif
"Tahun Depan RI Tak Impor Gula, Zulhas Mau Belajar dari Vietnam-Brasil",Netral
Cara Pertamina Manfaatkan Potensi Energi Baru Terbarukan,Positif
7 Wisata Alam Indonesia yang Lagi Hits dan Terbaru di 2023,Netral
Kronologi Lengkap Penemuan Bungkusan Pipa-Jam di Dekat Denpom Solo,Positif
"Jokowi Tambah 13 Proyek Strategis Baru, Ada yang di IKN",Netral
Respons PT Jaswita Jabar Usai Hibisc Fantasy Dibongkar,Positif
"Eks Dirut PTPN III Didakwa Terima Suap dari Pengusaha Pieko Rp 3,5 M",Positif
"Diduga Strok, Kepala Bapenda Subang Kecelakaan Tabrak Mobil-2 Motor",Negatif
Ricuh! Petani Korban Penggusuran Demo Kantor Bupati Enrekang,Negatif
"Rekayasa 'Ganja Tak Bertuan', 8 Oknum Polisi di Sumut Divonis 10-20 Tahun Bui",Netral
"Harga Gula Tingkat Petani Rp 11.500/Kg, di Konsumen Rp 13.500/Kg",Positif
Resmi! Amran Sulaiman Jadi Mentan Gantikan SYL,Positif
"Usai Lapak PKL Dibongkar, Kini Vila Liar di Puncak Disasar",Negatif
"Menaker Puji Perjanjian Kerja Bersama PTPN III & FSBUN, Ini Harapannya",Positif
"Bersama MarkPlus, Pemkab Musi Luncurkan Buku Musi Banyuasin 2030",Netral
Tuntutan Penjara 2 Tahun untuk Samsul Tarigan,Negatif
Bupati Batu Bara Marah Proyek Parit Mepet ke Badan Jalan-Bahayakan Pengendara,Negatif
Pengusaha Sarankan BUMN Kuasai Kebun Sawit RI Biar Minyak Goreng Murah,Netral
Teten Klaim Chef Juna Puji Kualitas Minyak Makan Merah,Positif
"Soal FPI atau Front Persatuan Islam, BPN: PTPN Minta Tanah Dikembalikan",Positif
"BUMN Dapat Suntikan Rp 57 Triliun, Buat Apa Saja?",Netral
"Tekan Impor, RI Gandeng Qatar Kerja Sama Garap Industri Susu Lokal",Netral
Terabas Desa Terisolir Lokasi Longsor Bogor Pakai Motor Off Road,Netral
"Mau IPO Rp 10 T, PalmCo Bakal Bangun Pabrik Minyak Goreng",Netral
Sejarah RS Pemerintah Pertama di Medan dan Pergantian Nama dari Masa ke Masa,Netral
"Nekat Panjat Sutet Buat Selfie, Pria Garut Kesetrum Hingga Gosong",Positif
"Banjir Bandang di Puncak Bogor, Warga Diungsikan ke Wisma PTPN",Negatif
"6 Fakta Menarik Gunung Semeru, Yuk Cari Tahu Sebelum Mendaki",Negatif
Daftar Terbaru Komisaris BUMN yang Resign Usai Masuk Timses Capres,Negatif
"BUMN Kebun Bentuk PalmCo, Pasokan Minyak Goreng Dijamin Aman?",Negatif
PTPN IV Bantah Racuni Puluhan Lembu Warga di Asahan,Negatif
Petani Kopi Perlu Waspadai Ancaman Iklim Ini Biar Tetap Cuan,Negatif
"Pelajar di Sumut Tewas Ditembak, Polisi Buru Pelaku",Negatif
Pihak HRS Siap Hadapi 29 Laporan PTPN VIII soal Lahan Megamendung,Positif
PTPN VIII Tak Ambil Pusing Tim Rizieq Sowan Kantor Mahfud soal Markaz Syariah,Negatif
Tim Markaz Syariah FPI Ogah Tanggapi Klaim PTPN VIII soal Sengketa Lahan,Negatif
"PalmCo Garap Kebun Sawit Terluas di Dunia, Ini Strateginya",Netral
Pilunya Warga Labuhanbatu Tewas Tersambar Petir saat Lomba HUT RI,Negatif
"Kurangi Emisi, Pupuk Indonesia Dukung Pilot Proyek Perdagangan Karbon",Positif
Warga di Asahan Demo Kantor Kebun Sawit Buntut Puluhan Lembu Mati Diduga Diracun,Negatif
Jabar Hari Ini: KKN 10 Tahun Lalu Antarkan Kamil Nikahi Khansa,Positif
Jokowi Minta Gubernur-Bupati Tentukan Lahan Relokasi Korban Longsor Bogor,Negatif
"Dampak Ledakan Pabrik Bioetanol di Mojokerto, Sejumlah Rumah Warga Rusak",Negatif
"Pakai Batik Kuning, Sahrul Gunawan Sambut Kunjungan Wabup Bantul",Netral
Aksi BUMN Dorong Pengembangan Infrastruktur Hijau,Positif
KPK Panggil Direktur PTPN XI Terkait Dugaan Korupsi Pengadaan Lahan Tebu,Netral
"Bupati Batang Ibaratkan Mudahnya Izin: Datang Bawa KTP, Pulang Bawa Motor",Negatif
"4 Truk-2 Minibus Kecelakaan Beruntun di Jambi, 2 Rumah Rusak",Netral
Sentul City Respons Aksi Marah-marah Brigjen Tumilaar soal Lahan Warga,Positif
Sederet Wisata dan Karnaval yang Jadi Daya Tarik Jember,Positif
Ada Kisah Menyeramkan di Balik Pembangunan Rumah Peninggalan Meneer Belanda,Netral
Pj Gubernur Sulsel Minta BPN Urus Aset Tanah Warga Terdampak Banjir-Longsor,Negatif
"Dear Mahasiswa Unimed, Lakukan Hal Ini Jika Mau Dapat Beasiswa",Positif
Rapim TNI AD Bahas Pesan Prabowo soal Ketahanan Pangan-Batalion Kesehatan,Positif
Pembangunan Huntap Penyintas Pergerakan Tanah Sukabumi Disetop,Netral
"Jaksa Tuntut Samsul Tarigan 2 Tahun Penjara, Perintahkan Segera Ditahan",Negatif
Polisi Ungkap 1 Hektare Ladang Ganja di Perbukitan Bandung,Negatif
Bey Prioritas Keselamatan Warga Terdampak Bencana di Sukabumi,Negatif
Erick Thohir Ungkap Rahasia Krakatau Steel Untung Rp 1 T,Netral
Bupati Sukabumi soal Aktivitas Tambang Jadi Penyebab Bencana,Negatif
Polisi Ungkap Sopir Pukul Kepala Pensiunan PTPN V hingga Tewas Pakai Asbak,Negatif
"Protes Jalan Rusak, Warga Labuhanbatu Tanam 1.000 Pohon",Negatif
"Terungkap! Luasan Agrowisata di Puncak Melebihi Batas, Diduga Sebabkan Banjir",Negatif
"Sukses Transformasi, PTPN Dulu Rugi Kini Untung Terus",Netral
Trik Belanda Tutupi Kerusakan Jalan di Cipetir Sukabumi,Negatif
Implementasi Cofiring PLTU Dinilai Tingkatkan Skala Ekonomi Biomassa,Positif
"Imbas Longsor, 2.194 Rumah di Bogor Direlokasi",Netral
Tim Satgas Pangan Sumut Minta PTPN II Lelang Gula Rp 11.200/kg,Negatif
Profil Dirut Berdikari yang Dicopot Erick Thohir Buntut Pistolnya Meletus di Bandara,Netral
"Produksi Gula RI Ditargetkan 2,7 Juta Ton di 2025, Tertinggi Sepanjang Sejarah",Positif
"Targetkan Kenaikan Bongkar Muat, Pelindo I Keluarkan Jurus Ini",Negatif
Kejati Sulteng Usut Dugaan Korupsi PT RAS Morut Caplok Kawasan HGU PTPN XIV,Negatif
"Pemerintah Guyur BUMN Rp 75 T Sepanjang 2020, Ini Rinciannya",Netral
"BUMN Penghasilan Rp 50 M ke Bawah Mau Dijual, Arya Sinulingga: Banyak!",Positif
"Walkot Semarang Imbau Warga Tak Beli Bahan Pokok Berlebih, Ini Alasannya",Negatif
"RI Targetkan Swasembada Gula di 2025, BUMN Bisa Apa?",Netral
"Ada BUMN 'Nakal' Lelang Gula di Atas HET, Bakal Kena Sanksi?",Negatif
Penangkapan Spesialis Curanmor di Lampung Diwarnai Baku Tembak,Negatif
Bupati Ipuk Optimalisasi Layanan Publik Saat Ngantor di Desa Ujung Selatan,Negatif
"Yuk Menikmati Suasana Desa 'Coklat' di Banyuwangi, Suejuk Masszzeh!",Positif
Wamen BUMN Resmikan 3 Pembangkit Tenaga Biogas di Riau,Positif
"Nambah Lagi, 7 Dapen BUMN Bakal Dilaporkan ke Kejaksaan Agung",Positif
"Mau Geser Impor BBM, Erick Thohir Genjot Produksi Etanol",Netral
Kabar Baik! Harga Sawit di Riau Pekan Ini Tembus Rp 2.552/Kg,Positif
KPK Panggil Eks GM Pabrik terkait Kasus Pengadaan Mesin Giling Tebu PTPN XI,Negatif
Duh! Deni Luka Bakar 80 Persen Akibat Panjat SUTET demi Konten,Negatif
Sub Holding BUMN Sawit Bakal Genjot Hilirisasi Minyak Goreng,Positif
Polda Jambi Geledah Kantor PTPN VI Jambi Usut Dugaan Korupsi Mark Up,Negatif
Lokasi Temuan 206 Granat Tangan Aktif di Banyuwangi Bekas Basecamp Belanda,Positif
"Pemerintah Akan Bentuk Satuan Pelayanan Gizi, Anggaran Rp 11 Miliar",Positif
"Erick Ungkap Dana Pensiun BUMN Bikin Kerugian Negara Rp 300 M, Ini 5 Faktanya",Negatif
Populer: Kota Mati Tommy Soeharto di Karawang,Netral
Konsesi Kereta Cepat JKT-BDG Diminta Jadi 80 Tahun karena Lama Balik Modal?,Negatif
Lahan Warpat Puncak Bakal Disulap Jadi Anjungan Pandang,Positif
SPBUN Tegaskan Tak Ada Sengketa Lahan Antara Warga dan PTPN,Netral
"Kejar Target Swasembada Gula 2025, PTPN Perluas Lahan Tanam Tebu",Netral
Sekdes soal Ibu Ngaku Curi Sawit untuk Beli Beras: Dia Punya 2 Motor,Negatif
8 Rekomendasi Wisata Sejarah dan Warisan Budaya di Surabaya,Netral
"Banjir Bandang Terjang Puncak, Agro Wisata Gunung Mas Tutup Sementara",Negatif
Jampidum Kejagung: Masih Ada Mafia Tanah di Kantor BPN!,Negatif
"Remaja di Riau Viral Hina Jokowi, Ditangkap Lalu Kena Wajib Lapor",Negatif
Begini Kondisi Suram PTPN Sebelum 'Diutak-atik' Erick Thohir,Negatif
"Erick Thohir Mau Bikin Klaster Pangan, Apa Maksudnya?",Netral
Penataan Bekas Lapak PKL di Puncak: Dibangun Pedestarian Hingga Anjungan Pandang,Positif
HRS Merasa Dibungkam Saat Sengketa Markaz Syariah Dibawa ke Polisi,Netral
"Sawit Laris Manis, Holding Perkebunan Cuan Rp 3,8 Triliun",Negatif
"KM Kelud yang Bawa ABK PDP Corona Tiba di Medan, 35 Penumpang Dikarantina",Netral
"Sengketa Lahan PTPN vs Markaz Syariah, Ekspor Benur Minta Disetop",Netral
"Temui Warga Onggoboyo, Mas Dhito Janji Hadirkan Akses Jalan-Air Bersih",Positif
"Mau Digabungkan dengan Bulog dan RNI, Bos PTPN Setuju?",Netral
Pabrik Migor Berkapasitas 2.500 Ton/Hari Dibangun di KEK Sei Mangkei,Netral
Pj Gubernur Sulsel Minta Penyuluh Petani Cari Lahan 2 Ha untuk Tanam Pisang,Negatif
"PTPN Somasi Markaz Syariah, FPI: Siap Lepas Lahan, Silakan Ganti Rugi",Negatif
Samsul Tarigan Tak Ditahan di Kasus Penguasaan Lahan yang Rugikan PTPN Rp 41 M,Netral
"Dividen BUMN ke Negara Terkumpul Rp 35,5 T, Pertamina Belum Setor",Netral
Ketika Menko Mahfud Wacanakan 'Ponpes Bersama' Markaz Syariah,Negatif
"Petani Keluhkan Harga Pupuk Naik, Jokowi Sebut Gara-gara Perang",Netral
KPK Tetapkan Eks Direktur PTPN XI Jadi Tersangka Korupsi Mesin Giling Tebu,Negatif
Kejati Kalbar Tahan 5 Tersangka Korupsi Penanaman Kelapa Sawit di PTPN XIII,Negatif
BI Dorong Pemprov Jabar Terus Kawal Komitmen Investor di WJIS 2020,Positif
Ranca Upas Dibuka Lagi untuk Wisatawan,Netral
"Pembelian Lahan dari Petani Disebut Salah, Ini Kata Markaz Syariah",Negatif
"Kebut Target Swasembada Gula, Sugar Co Gandeng Swasta Sudah Tepat?",Netral
"Mau Fokus Bisnis, BUMN Pangan Lanjut Jualan Kondom Meong?",Positif
"Pensiunan TNI Dibacok di Areal Perkebunan di Siantar, Pelaku Ditangkap",Negatif
